{"appid":"1517180","assignment":{"appid":"1517180","assignment_id":"shadow-03-1517180-f5c600719f68","group_sequence":3,"item_index":1,"manifest_blob_sha":"b4eed914f576889aad65a4bd30c0de8ad574da5b","marker_commit":"19a22d17ca31b219ec317042f60de6a4655a1cab","original_assignment_sha256":"4d17c67a9d9314d560c85787bb66f516a39dca10b5ad4f415fd2ecde286441a1","title":"Mindcop","trial_id":"dossier-notes-v2-original18-first"},"canonical_acceptance":false,"disposition":"safe_incomplete_research","phase":"research","schema":"DOSSIER-NOTES-V2-ITEM-RECEIPT","schema_version":2,"semantic_attempt_state":"unknown","source":{"candidate":{"blob_sha":"9873a6c63f1c85ce8421b6b08b238607e6881cef","canonical_sha256":"ae26024a397fe51c0802421c4768e6a2724f1656d88914f9346c2eeeb949b2ae","commit":"5a4edefc9cf2a270e4744d21e094b8b9d8005163","path":"data/ai_inbox/dossier_notes_v2/dossier-notes-v2-original18-first/g000003/1517180--shadow-03-1517180-f5c600719f68.json","raw_sha256":"ae26024a397fe51c0802421c4768e6a2724f1656d88914f9346c2eeeb949b2ae"},"candidate_status":"safe_incomplete_research","github_receipt_confirmed":false,"introduction_commit":"5a4edefc9cf2a270e4744d21e094b8b9d8005163","issuer":{"authorization_blob_sha":"814c413496a405247c85f813183b64c5010e26c7","authorization_commit":"c11177e1896fbf9379c4cf12266f188ee5dd754d","github_actor_id":"315790060","github_authorization_run_id":"40511113365","github_run_authenticated":false,"human_grant_commit":"71a369015d74eba554975458039721c271159111","issuer_structural_only":true,"manifest_blob_sha":"b4eed914f576889aad65a4bd30c0de8ad574da5b","marker_commit":"19a22d17ca31b219ec317042f60de6a4655a1cab","marker_nonce":"bd5b60b3314589e6cd7f7e79cf4e1b31","marker_parent":"faed495b9e58b37d5db23b9178d372d90f1b2ed4","semantic_execution_authorized":true,"trial_id":"dossier-notes-v2-original18-first"},"receipt_parent_commit":"5a4edefc9cf2a270e4744d21e094b8b9d8005163","transport_technically_verified":true},"staged_only":true,"trial_id":"dossier-notes-v2-original18-first"}